date,title,url
05.15.2018,U.S. soybeans at risk in trade dispute with China,https://www.foodbusinessnews.net/articles/11829-us-soybeans-at-risk-in-trade-dispute-with-china
04.23.2018,Organic grain prices mixed in first quarter,https://www.foodbusinessnews.net/articles/11687-organic-grain-prices-mixed-in-first-quarter
02.27.2018,"Organic winter wheat, corn prices climb",https://www.foodbusinessnews.net/articles/11375-organic-winter-wheat-corn-prices-climb
12.18.2017,"Organic durum prices higher, winter wheat lower in quarter",https://www.foodbusinessnews.net/articles/11028-organic-durum-prices-higher-winter-wheat-lower-in-quarter
04.18.2017,"Mixed data signals but plenty of grain, soybeans going forward",https://www.foodbusinessnews.net/articles/10464-mixed-data-signals-but-plenty-of-grain-soybeans-going-forward
04.11.2017,U.S.D.A. raises 2017 wheat carryover 3% from March,https://www.foodbusinessnews.net/articles/9183-u-s-d-a-raises-2017-wheat-carryover-3-from-march
01.12.2017,"U.S. corn, soybean production down 1% from November",https://www.foodbusinessnews.net/articles/8756-u-s-corn-soybean-production-down-1-from-november
03.02.2016,Research assesses agriculture without G.M.O.s,https://www.foodbusinessnews.net/articles/7656-research-assesses-agriculture-without-g-m-o-s
05.12.2015,U.S. 2016 wheat carryover up 12% from 2015,https://www.foodbusinessnews.net/articles/6136-u-s-2016-wheat-carryover-up-12-from-2015
04.08.2015,Cargill deal in Zambia moves closer to completion,https://www.foodbusinessnews.net/articles/5870-cargill-deal-in-zambia-moves-closer-to-completion
04.07.2015,Farmers’ planting intentions vary from expectations,https://www.foodbusinessnews.net/articles/5894-farmers-planting-intentions-vary-from-expectations
12.31.2014,2014 markets in review,https://www.foodbusinessnews.net/articles/3508-2014-markets-in-review
04.16.2014,Larger supplies expected to send prices lower,https://www.foodbusinessnews.net/articles/4078-larger-supplies-expected-to-send-prices-lower
04.09.2014,U.S. wheat carryover up 4% from March,https://www.foodbusinessnews.net/articles/4160-u-s-wheat-carryover-up-4-from-march
04.08.2014,Soybean crop remains front and center,https://www.foodbusinessnews.net/articles/4133-soybean-crop-remains-front-and-center
03.25.2014,Purchasing insight: Are soybeans in the driver's seat this year?,https://www.foodbusinessnews.net/articles/3819-purchasing-insight-are-soybeans-in-the-driver-s-seat-this-year
02.20.2014,"10-year U.S.D.A. outlook: Big jump in corn, soy trade",https://www.foodbusinessnews.net/articles/3641-10-year-u-s-d-a-outlook-big-jump-in-corn-soy-trade
02.18.2014,Torrid soybean export pace hints at bigger supplies,https://www.foodbusinessnews.net/articles/3788-torrid-soybean-export-pace-hints-at-bigger-supplies
01.16.2014,Record soybean crush adds to oilseed bullishness,https://www.foodbusinessnews.net/articles/3204-record-soybean-crush-adds-to-oilseed-bullishness
01.10.2014,U.S. corn production down slightly from November,https://www.foodbusinessnews.net/articles/3242-u-s-corn-production-down-slightly-from-november
12.03.2013,U.S.D.A. raises forecast value of fiscal 2014 ag exports,https://www.foodbusinessnews.net/articles/1503-u-s-d-a-raises-forecast-value-of-fiscal-2014-ag-exports
11.08.2013,U.S.D.A. raises corn crop 1% from September,https://www.foodbusinessnews.net/articles/1379-u-s-d-a-raises-corn-crop-1-from-september
10.15.2013,"Harvest ‘guesstimates’ sustain corn, soybean market",https://www.foodbusinessnews.net/articles/1145-harvest-guesstimates-sustain-corn-soybean-market
09.18.2013,China buys 1.93 million tonnes of U.S. soybeans,https://www.foodbusinessnews.net/articles/2942-china-buys-1-93-million-tonnes-of-u-s-soybeans
09.12.2013,Surprising change in corn crop forecast,https://www.foodbusinessnews.net/articles/3083-surprising-change-in-corn-crop-forecast
08.27.2013,"Soybean, corn crop conditions deteriorate, U.S.D.A. says",https://www.foodbusinessnews.net/articles/2882-soybean-corn-crop-conditions-deteriorate-u-s-d-a-says
08.12.2013,U.S. 2014 wheat carryover down 4% from July,https://www.foodbusinessnews.net/articles/2901-u-s-2014-wheat-carryover-down-4-from-july
07.19.2013,Chipotle chips away at non-bioengineered goals,https://www.foodbusinessnews.net/articles/2566-chipotle-chips-away-at-non-bioengineered-goals
06.28.2013,"Corn, soybean, spring wheat area up from 2012",https://www.foodbusinessnews.net/articles/2395-corn-soybean-spring-wheat-area-up-from-2012
06.10.2013,Trade sees planting edging higher,https://www.foodbusinessnews.net/articles/2512-trade-sees-planting-edging-higher
05.24.2013,China buys U.S. soft red winter wheat,https://www.foodbusinessnews.net/articles/2188-china-buys-u-s-soft-red-winter-wheat
05.10.2013,U.S. 2014 wheat carryover 8% below 2013,https://www.foodbusinessnews.net/articles/2333-u-s-2014-wheat-carryover-8-below-2013
05.07.2013,Corn planting slowest since 1984,https://www.foodbusinessnews.net/articles/2200-corn-planting-slowest-since-1984
04.30.2013,"Corn limit up Monday, wheat conditions slip",https://www.foodbusinessnews.net/articles/1995-corn-limit-up-monday-wheat-conditions-slip
04.10.2013,U.S. 2013 wheat carryover up 2% from March,https://www.foodbusinessnews.net/articles/2133-u-s-2013-wheat-carryover-up-2-from-march
03.08.2013,U.S. 2013 wheat carryover up 4% from February,https://www.foodbusinessnews.net/articles/1932-u-s-2013-wheat-carryover-up-4-from-february
03.04.2013,February all-wheat price up 65c from year earlier,https://www.foodbusinessnews.net/articles/1799-february-all-wheat-price-up-65c-from-year-earlier
02.08.2013,U.S. 2013 wheat carryover down 3% from January,https://www.foodbusinessnews.net/articles/1715-u-s-2013-wheat-carryover-down-3-from-january
01.11.2013,U.S. 2013 wheat carryover down 5% from December,https://www.foodbusinessnews.net/articles/1042-u-s-2013-wheat-carryover-down-5-from-december
12.06.2012,High food inflation hints of drought effects,https://www.foodbusinessnews.net/articles/751-high-food-inflation-hints-of-drought-effects
03.13.2012,Global soybean supply tightening,https://www.foodbusinessnews.net/articles/10385-global-soybean-supply-tightening
